{
  "schema": 1,
  "contract_version": 1,
  "default_by_kind": {
    "idea": "medium",
    "feature": "medium",
    "bug": "small",
    "refactor": "small",
    "performance": "medium",
    "security": "medium",
    "audit": "medium"
  },
  "tiers": {
    "small": {"calls": 12, "input_tokens": 240000, "output_tokens": 48000, "context_tokens": 40000, "wall_time_seconds": 3600, "repair_attempts": 1, "specialist_escalations": 2},
    "medium": {"calls": 24, "input_tokens": 600000, "output_tokens": 120000, "context_tokens": 80000, "wall_time_seconds": 10800, "repair_attempts": 2, "specialist_escalations": 6},
    "large": {"calls": 40, "input_tokens": 1400000, "output_tokens": 280000, "context_tokens": 120000, "wall_time_seconds": 21600, "repair_attempts": 3, "specialist_escalations": 10}
  },
  "hard_maximum": {"calls": 48, "input_tokens": 1800000, "output_tokens": 360000, "context_tokens": 160000, "wall_time_seconds": 28800, "repair_attempts": 3, "specialist_escalations": 12},
  "development": {"total_charge_usd": 250, "per_fixture_charge_usd": 25}
}
